### ISSUE TITLE
KittyHack shows a solid red after 60 minutes

### ISSUE THREAD

**Issue by sensorius** [floppyFK/kittyhack#6]
I successfully installed the KittyHack on an unregistered KittyFlap after modifying WiFi credentials and KittyFlap is showing a green status light after powering it up. 
However the status light turns off after 60 minutes. A minute later the light is showing a flashing red status for a couple of seconds before it lights up in solid red.

Any ideas what the status light modes could mean?
Attached are my „Debug details“ of KittyHack. 

![Bildschirmfoto 2024-12-29 um 12 20 23](https://github.com/user-attachments/assets/746cef97-11c5-4a49-9196-30d3a500f1d4)

FYI: KittyFlap (192.168.1.121.) downloads Debian updates and connects to a Linode server when the green light has turned off:

**13:10:25**.620211 IP 192.168.1.121.56236 > 151.101.194.132.http: Flags [P.], seq 205:427, ack 292, win 249, options [nop,nop,TS val 4255203012 ecr 464841289], length 222: HTTP: GET /debian-security/dists/bookworm-security/InRelease HTTP/1.1

**13:11:55**.889437 IP 192.168.1.121.47042 > li1742-188.members.linode.com.https: Flags [.], ack 1, win 251, options [nop,nop,TS val 1577686009 ecr 2281766671], length 0
13:11:55.905799 IP 192.168.1.121.47042 > li1742-188.members.linode.com.https: Flags [P.], seq 1:518, ack 1, win 251, options [nop,nop,TS val 1577686026 ecr 2281766671], length 517

Why is a connection made to cloud hoster "vultr.com" aka "vultrusercontent.com"?
**13:11:58**.302572 IP 45.63.4.8.vultrusercontent.com.https > 192.168.1.121.53230: Flags [.], seq 65426:66866, ack 835, win 486, options [nop,nop,TS val 784108379 ecr 2513002170], length 1440

Just downloading Debian updates...?

**Comment by sensorius** [comment]
Connections to  "linode" and "vultr" servers are presumably established every 60 minutes. No change in status light after all, still showing a solid red.

**14:10:32**.706606 IP 192.168.1.121.36038 > 145.111.160.34.bc.googleusercontent.com.http: Flags [S], seq 3606221150, win 32120, options [mss 1460,sackOK,TS val 32587549 ecr 0,nop,wscale 7], length 0
<SNIP>
**14:10:32**.920119 IP 192.168.1.121.54452 > li1742-188.members.linode.com.https: Flags [S], seq 3853894407, win 32120, options [mss 1460,sackOK,TS val 1581203040 ecr 0,nop,wscale 7], length 0
<SNIP>
**14:10:34**.447104 IP 192.168.1.121.44478 > 45.63.4.8.vultrusercontent.com.https: Flags [S], seq 647249475, win 32120, options [mss 1460,sackOK,TS val 2516518405 ecr 0,nop,wscale 7], length 0

**Comment by FabulousGee** [comment]
Could be due to an old version currently installed on the flap which may not be compatible to the current KittyHack.
Could you possibly share the contents of /root/setup/values.json?

If you are very committed you could share even a zip or anything containing the following folders/files:
/root/AIContainer/
/root/kittyflap_versions/
/root/libcamera-dependencies/
/root/libcamera-ipa-libs/
/root/setup/
/root/kittyflap.db
/root/kittyflap.db-journal
/root/kportal-token
/root/manager

I sent you a short mail to the email mentioned on your GitHub profile so you don't need to share it publically - I guess there is nothing to hide in it, but you never know...

**Comment by FabulousGee** [comment]
So to further answer to your questions:
I personally have not looked into the connections in detail yet. Maybe @floppyFK has more intel on these since he also disabled some stuff via KittyHack installer.

I just had a look at the update mechanism while KittyFlap was still online (I don't rely on blackboxes). They had the different versions uploaded in some kind of fileshare, iirc it was some Google stuff. But that may have changed across the versions, maybe they used Vultr/Linode before and switched to Google later on?

Could be possible that the red light indicates missing connection to the main server which is checked regularly also in later versions.
Maybe we can build an update mechanism, I am currently working on a backend server mocking the original. That would be sweet to have a KittyFlap not updated yet to get the requests KittyFlap sents to the server to initate the update.

**Comment by sensorius** [comment]
> Could you possibly share the contents of /root/setup/values.json?

Your are welcome :-)

root@kittyflap-80605700...:~/setup# cat values.json
{
  "database_version": "v1",
  "device_type": "",
  "factory_public_key": "",
  "https_certs": "true",
  "kittyflap_mode": "qa",
  "kportal_url": "http://127.0.0.1:9999",
  "previous_version": "0.0.242",
  "version_name": "0.0.272",
  "wifi_password": [
    "GEG-1234",
    "Graewer2023",
    "Graewer2023"
  ],
  "wifi_ssid": [
    "GEG-Gast",
    "Graewer factory",
    "Graewer Factory"
  ]

**Comment by FabulousGee** [comment]
Okay, so thats a first indicator.

In mine, there is the following version information:
"previous_version": "0.0.292"
"version_name": "0.0.293"

Should be the latest available before they went into insolvency.

**Comment by floppyFK** [comment]
In the current release version `v1.1.0` of Kittyhack, all sensors and indicators (such as the LED light) are fully controlled by the original `kwork` process (the Kittyflap’s main application). At this point, we have no stable access to these sensors, as their states - if we even manage to access them - would be overridden all the time by the kwork process.

Currently, Kittyhack functions only as a frontend for the kwork process. I didn’t spend too much time investigating the original kwork's behavior, since this software is a piece of **** - it consumes a lot of RAM and requires periodic restarts every 60 minutes. This could also explain the connection attempts to "vultrusercontent.com" and "linode.com," which may be hardcoded into kwork.

I’m actively working on a complete replacement of the kwork process in the [full-replacement-of-ai-logic](https://github.com/floppyFK/kittyhack/tree/full-replacement-of-ai-logic) branch. Camera integration, AI logic, RFID, PIR sensors, and magnets are already working quite stably.

I "just" need to update the entire frontend so that the flap can be configured and controlled via the web interface. (**Warning** if you plan to test this yourself: I have already damaged some MOSFETs for the magnets on the mainboard due to a rapid **single** ON-OFF-ON pulse to a magnet… The hardware is clearly not designed to handle such loads.)

I’ve prepared a workaround, and the necessary hardware components for a simple and robust solution have already been ordered and are on the way. I’ll test it and share the results once everything works properly. 😉

**Comment by sensorius** [comment]
@floppyFK  @FabulousGee  - Your work is really impressive, just took a quick look at the source code. Let me know if you need help. I'm happy to provide support wherever I can.

**Comment by FabulousGee** [comment]
@sensorius thanks but I didn't do so much, most work is done by floppyFK - just adding my 2 cents here and there

I didn't have much time lately, so sorry for not replying/adding the update mechism.
In addition to that guess that this issue is obsolete by release of v1.2.0 - please get back in touch if you think it is not.

**Comment by sensorius** [comment]
Updated to KittyHack V1.2.0 replacing original software.
